{
  "deliverable": "merge-process-skill",
  "phase_a": {
    "artifacts_present": true,
    "acceptance_criteria": [],
    "plan_completion": {
      "planned_files_touched": true,
      "unplanned_changes": []
    },
    "verdict": "pass"
  },
  "phase_b": {
    "dimensions": [
      {
        "name": "correctness",
        "verdict": "fail",
        "evidence": "`XDG_STATE_HOME=/tmp/furrow-review-state bash tests/integration/test-merge-e2e.sh` passes only because `test_safe_e2e_verify_green` accepts verify exit `7`; the run shows `frw doctor` returning `RESULT: FAIL`, so the AC requiring a clean merge with doctor green is not met."
      },
      {
        "name": "test-coverage",
        "verdict": "fail",
        "evidence": "`shellcheck` reports `bin/frw.d/scripts/merge-resolve-plan.sh:111` `_get_machine_merge_details()` is never invoked (`SC2329`), so this new branching helper has no exercised test path."
      },
      {
        "name": "spec-compliance",
        "verdict": "fail",
        "evidence": "The contract says all phases reject invalid policy via `schemas/merge-policy.schema.json`, but `bin/frw.d/scripts/merge-lib.sh` only greps for top-level keys and `schema_version`; it never validates against the schema file."
      },
      {
        "name": "unplanned-changes",
        "verdict": "fail",
        "evidence": "Wave-3 file ownership in `.furrow/rows/install-and-merge/plan.json` is limited to merge command/scripts/policy/tests, but the submitted diff also changes out-of-scope files like `install.sh`, `bin/frw.d/install.sh`, `schemas/reintegration.schema.json`, and many `.furrow/...` artifacts without a merge-process-skill-specific justification."
      },
      {
        "name": "code-quality",
        "verdict": "fail",
        "evidence": "`shellcheck` reports concrete issues in delivered files, including `bin/frw.d/scripts/merge-verify.sh:168` using undefined variable `rescue_path` (`SC2154`) and `bin/frw.d/hooks/script-guard.sh:1` missing a shebang/shell directive (`SC2148`)."
      }
    ],
    "verdict": "fail"
  },
  "overall": "fail",
  "corrections": 0,
  "reviewer": "codex",
  "cross_model": true,
  "timestamp": "2026-04-22T22:05:15Z"
}
