{
  "deliverable": "row-model-continuation",
  "phase_a": {
    "artifacts_present": true,
    "acceptance_criteria": [
      {
        "criterion": "The row continues inside pi-adapter-foundation without creating another todo-specific Furrow row.",
        "met": true,
        "evidence": "Row is a phantom: scope was satisfied by sibling row pi-step-ceremony-and-artifact-enforcement (commit e4adef5). No additional todo-specific row was created."
      },
      {
        "criterion": "Row-local artifacts record the current emphasis as work-loop-boundary-hardening inside the roadmap-row work unit.",
        "met": true,
        "evidence": "Superseded by pi-step-ceremony-and-artifact-enforcement which delivered the equivalent work-loop-boundary-hardening artifacts."
      },
      {
        "criterion": "Supported backend or adapter ceremony remains ahead of implementation in this session.",
        "met": true,
        "evidence": "Backend ceremony delivered in commit e4adef5 (pi-step-ceremony-and-artifact-enforcement)."
      }
    ],
    "plan_completion": {
      "planned_files_touched": false,
      "unplanned_changes": []
    },
    "verdict": "pass"
  },
  "phase_b": {
    "dimensions": [
      {
        "name": "correctness",
        "verdict": "pass",
        "evidence": "Phantom row: no implementation performed here; scope satisfied by superseding row (commit e4adef5)."
      }
    ],
    "verdict": "pass"
  },
  "overall": "pass",
  "corrections": 0,
  "reviewer": "harness-engineer (supersedence review)",
  "cross_model": false,
  "timestamp": "2026-04-25T04:10:00Z"
}
