{
  "deliverable": "narrative-assessment",
  "phase_a": {
    "artifacts_present": true,
    "acceptance_criteria": [
      { "criterion": "One section per research insight (8 sections)", "met": true, "evidence": "Sections titled Insight 1 through Insight 8, each with Research said / Implementation delivers / Gap pattern" },
      { "criterion": "Describes how implementation embodies or deviates from each insight", "met": true, "evidence": "Each section explicitly addresses both. Insight 3: 'Gap: This is the widest deviation from research intent'" },
      { "criterion": "Includes implementation-originated innovations section", "met": true, "evidence": "Dedicated section with 6 enumerated items: learnings capture, context budget measurement, red flags catalog, rewind, hook-based state protection, post-compaction recovery" },
      { "criterion": "Assesses drift toward warned failure modes", "met": true, "evidence": "Failure Mode Drift Assessment section with 5-row table mapping each v1 failure mode to current risk level, all rated Low with evidence" }
    ],
    "plan_completion": {
      "planned_files_touched": true,
      "unplanned_changes": []
    },
    "verdict": "pass"
  },
  "phase_b": {
    "dimensions": [
      { "name": "coverage", "verdict": "pass", "evidence": "All 8 insights assessed plus implementation innovations (6 items), failure mode drift (5 modes), and 5 architectural gap categories" },
      { "name": "depth", "verdict": "pass", "evidence": "Distinguishes structural presence from operational wiring. Insight 5: 'Nothing prevents a review agent from having the same context as the implementer'" },
      { "name": "sources", "verdict": "pass", "evidence": "Consistent artifact path references: scripts/measure-context.sh, adapters/claude-code/progressive-loading.yaml, hooks/post-compact.sh" },
      { "name": "synthesis", "verdict": "pass", "evidence": "Overall verdict: 'The architecture is right; the teeth are missing.' Scorecard synthesizes across 9 dimensions" },
      { "name": "actionability", "verdict": "pass", "evidence": "Gap sections identify concrete needs. Gap B enumerates all 7 steps with artifact validation Yes/No table" }
    ],
    "verdict": "pass"
  },
  "overall": "pass",
  "corrections": 0,
  "reviewer": "research-reviewer-agent",
  "cross_model": false,
  "timestamp": "2026-04-02T09:30:00Z"
}
