{
  "deliverable": "gap-matrix",
  "phase_a": {
    "artifacts_present": true,
    "acceptance_criteria": [
      { "criterion": "Maps all 8 research insights to implementation evidence", "met": true, "evidence": "Section A contains 8 rows mapping insights 1-8 with artifact references and status" },
      { "criterion": "Maps all 15 gap review behaviors to enforcement mechanism status", "met": true, "evidence": "Section B contains 15 rows mapping behaviors 1-15 with enforcement mechanisms" },
      { "criterion": "Maps PLAN.md phases 1-6 to implementation coverage", "met": true, "evidence": "Section C maps all 6 phases with percent-complete and per-spec breakdowns, includes revised assessment" },
      { "criterion": "Each row includes planned item, artifact(s), and status", "met": true, "evidence": "All three tables follow pattern: planned item + artifact path(s) + status tag (Implemented/Partial/Absent)" }
    ],
    "plan_completion": {
      "planned_files_touched": true,
      "unplanned_changes": []
    },
    "verdict": "pass"
  },
  "phase_b": {
    "dimensions": [
      { "name": "coverage", "verdict": "pass", "evidence": "All 8 insights, 15 behaviors, 6 phases mapped. Section D identifies 11 additional architectural gaps" },
      { "name": "depth", "verdict": "pass", "evidence": "Revised Phase 2-3 assessment demonstrates genuine depth — caught own initial overestimation and corrected with evidence" },
      { "name": "sources", "verdict": "pass", "evidence": "Claims reference specific artifact paths. Minor imprecision: '8 dimension YAMLs' (actually 7), '80+ components' (actually 122)" },
      { "name": "synthesis", "verdict": "pass", "evidence": "Section summaries synthesize patterns: '5/8 fully implemented, 3/8 partial. The partials cluster around eval automation and runtime enforcement'" },
      { "name": "actionability", "verdict": "pass", "evidence": "Each Partial/Absent status directly informs fixes. Section D gap table includes severity ratings feeding into recommendations" }
    ],
    "verdict": "pass"
  },
  "overall": "pass",
  "corrections": 0,
  "reviewer": "research-reviewer-agent",
  "cross_model": false,
  "timestamp": "2026-04-02T09:30:00Z"
}
